{
  "contractVersion": "consent-authorization-census-coverage/v1",
  "version": 1,
  "axisAuthorities": {
    "key": "resolveConsentAuthorizationConstantKey",
    "specifier": "collectCanonicalModuleBinding"
  },
  "residualArms": {
    "key": { "arm": "key:runtime-unknown" },
    "specifier": { "arm": "specifier:runtime-unknown", "witnessRow": "specifier-runtime-unknown" }
  },
  "rows": [
    {
      "rowId": "key-direct-identifier-call",
      "axis": "key",
      "expressionKind": "Identifier",
      "arm": "consumption:direct-identifier",
      "shape": "the canonical constructor called directly through its own identifier",
      "fixture": "scripts/check-structure/fixtures/consent-authorization-sites/census/key-direct-identifier-call.ts",
      "plantedAt": "zz-unrelated/plain-directory/key-direct-identifier-call.ts",
      "signature": { "referenceClass": "consumption", "constructor": "authorizeConsentForActor" },
      "disposition": "classified",
      "census": "classified"
    },
    {
      "rowId": "key-string-literal-element-access",
      "axis": "key",
      "expressionKind": "StringLiteral",
      "arm": "key:element-access:written-string-literal",
      "shape": "element access whose key is written as a string literal",
      "fixture": "scripts/check-structure/fixtures/consent-authorization-sites/census/key-string-literal-element-access.ts",
      "plantedAt": "zz-unrelated/plain-directory/key-string-literal-element-access.ts",
      "signature": {
        "referenceClass": "unexpected",
        "constructor": "authorizeConsentForActor",
        "syntaxKind": "ElementAccessExpression"
      },
      "disposition": "classified",
      "census": "classified"
    },
    {
      "rowId": "key-no-substitution-template-element-access",
      "axis": "key",
      "expressionKind": "NoSubstitutionTemplateLiteral",
      "arm": "computed-property:element-access",
      "shape": "element access whose key is written as a no-substitution template",
      "fixture": "scripts/check-structure/fixtures/consent-authorization-sites/census/key-no-substitution-template-element-access.ts",
      "plantedAt": "zz-unrelated/plain-directory/key-no-substitution-template-element-access.ts",
      "signature": {
        "referenceClass": "unexpected",
        "constructor": "authorizeConsentForActor",
        "syntaxKind": "ElementAccessExpression"
      },
      "disposition": "classified",
      "census": "classified"
    },
    {
      "rowId": "key-string-literal-binding-element-property-name",
      "axis": "key",
      "expressionKind": "StringLiteral",
      "arm": "computed-property:binding-element-property-name",
      "shape": "a binding element whose property name is a string literal",
      "fixture": "scripts/check-structure/fixtures/consent-authorization-sites/census/key-string-literal-binding-element-property-name.ts",
      "plantedAt": "zz-unrelated/plain-directory/key-string-literal-binding-element-property-name.ts",
      "signature": {
        "referenceClass": "unexpected",
        "constructor": "authorizeConsentForActor",
        "syntaxKind": "BindingElement"
      },
      "disposition": "classified",
      "census": "classified"
    },
    {
      "rowId": "key-string-literal-computed-property-name-in-binding-element",
      "axis": "key",
      "expressionKind": "StringLiteral",
      "arm": "computed-property:binding-element-computed-name",
      "shape": "a computed property name inside a binding element written as a string literal",
      "fixture": "scripts/check-structure/fixtures/consent-authorization-sites/census/key-string-literal-computed-property-name-in-binding-element.ts",
      "plantedAt": "zz-unrelated/plain-directory/key-string-literal-computed-property-name-in-binding-element.ts",
      "signature": {
        "referenceClass": "unexpected",
        "constructor": "authorizeConsentForActor",
        "syntaxKind": "ComputedPropertyName"
      },
      "disposition": "classified",
      "census": "classified"
    },
    {
      "rowId": "key-element-access-over-lexical-constant",
      "axis": "key",
      "expressionKind": "Identifier",
      "arm": "constant-key:Identifier",
      "shape": "element access over an unshadowed lexical constant",
      "fixture": "scripts/check-structure/fixtures/consent-authorization-sites/census/key-element-access-over-lexical-constant.ts",
      "plantedAt": "zz-unrelated/plain-directory/key-element-access-over-lexical-constant.ts",
      "signature": {
        "referenceClass": "unexpected",
        "constructor": "authorizeConsentForActor",
        "syntaxKind": "ElementAccessExpression"
      },
      "disposition": "classified",
      "census": "classified"
    },
    {
      "rowId": "key-element-access-over-constant-template-expression",
      "axis": "key",
      "expressionKind": "TemplateExpression",
      "arm": "constant-key:TemplateExpression",
      "shape": "element access over a template expression whose substitutions are unshadowed lexical constants",
      "fixture": "scripts/check-structure/fixtures/consent-authorization-sites/census/key-element-access-over-constant-template-expression.ts",
      "plantedAt": "zz-unrelated/plain-directory/key-element-access-over-constant-template-expression.ts",
      "signature": {
        "referenceClass": "unexpected",
        "constructor": "authorizeConsentForActor",
        "syntaxKind": "ElementAccessExpression"
      },
      "disposition": "classified",
      "census": "classified"
    },
    {
      "rowId": "key-element-access-over-constant-concatenation",
      "axis": "key",
      "expressionKind": "BinaryExpression",
      "arm": "constant-key:BinaryExpression",
      "shape": "element access over constant concatenation",
      "fixture": "scripts/check-structure/fixtures/consent-authorization-sites/census/key-element-access-over-constant-concatenation.ts",
      "plantedAt": "zz-unrelated/plain-directory/key-element-access-over-constant-concatenation.ts",
      "signature": {
        "referenceClass": "unexpected",
        "constructor": "authorizeConsentForActor",
        "syntaxKind": "ElementAccessExpression"
      },
      "disposition": "classified",
      "census": "classified"
    },
    {
      "rowId": "key-element-access-over-parenthesized-constant",
      "axis": "key",
      "expressionKind": "ParenthesizedExpression",
      "arm": "constant-key:ParenthesizedExpression",
      "shape": "element access over a parenthesized constant key",
      "fixture": "scripts/check-structure/fixtures/consent-authorization-sites/census/key-element-access-over-parenthesized-constant.ts",
      "plantedAt": "zz-unrelated/plain-directory/key-element-access-over-parenthesized-constant.ts",
      "signature": {
        "referenceClass": "unexpected",
        "constructor": "authorizeConsentForActor",
        "syntaxKind": "ElementAccessExpression"
      },
      "disposition": "classified",
      "census": "classified"
    },
    {
      "rowId": "key-element-access-over-as-expression-constant",
      "axis": "key",
      "expressionKind": "AsExpression",
      "arm": "constant-key:AsExpression",
      "shape": "element access over a constant key wrapped in an as expression",
      "fixture": "scripts/check-structure/fixtures/consent-authorization-sites/census/key-element-access-over-as-expression-constant.ts",
      "plantedAt": "zz-unrelated/plain-directory/key-element-access-over-as-expression-constant.ts",
      "signature": {
        "referenceClass": "unexpected",
        "constructor": "authorizeConsentForActor",
        "syntaxKind": "ElementAccessExpression"
      },
      "disposition": "classified",
      "census": "classified"
    },
    {
      "rowId": "key-element-access-over-satisfies-expression-constant",
      "axis": "key",
      "expressionKind": "SatisfiesExpression",
      "arm": "constant-key:SatisfiesExpression",
      "shape": "element access over a constant key wrapped in a satisfies expression",
      "fixture": "scripts/check-structure/fixtures/consent-authorization-sites/census/key-element-access-over-satisfies-expression-constant.ts",
      "plantedAt": "zz-unrelated/plain-directory/key-element-access-over-satisfies-expression-constant.ts",
      "signature": {
        "referenceClass": "unexpected",
        "constructor": "authorizeConsentForActor",
        "syntaxKind": "ElementAccessExpression"
      },
      "disposition": "classified",
      "census": "classified"
    },
    {
      "rowId": "key-element-access-over-non-null-constant",
      "axis": "key",
      "expressionKind": "NonNullExpression",
      "arm": "constant-key:NonNullExpression",
      "shape": "element access over a constant key wrapped in a non-null assertion",
      "fixture": "scripts/check-structure/fixtures/consent-authorization-sites/census/key-element-access-over-non-null-constant.ts",
      "plantedAt": "zz-unrelated/plain-directory/key-element-access-over-non-null-constant.ts",
      "signature": {
        "referenceClass": "unexpected",
        "constructor": "authorizeConsentForActor",
        "syntaxKind": "ElementAccessExpression"
      },
      "disposition": "classified",
      "census": "classified"
    },
    {
      "rowId": "key-element-access-over-type-assertion-constant",
      "axis": "key",
      "expressionKind": "TypeAssertionExpression",
      "arm": "constant-key:TypeAssertionExpression",
      "shape": "element access over a constant key wrapped in an angle-bracket type assertion",
      "fixture": "scripts/check-structure/fixtures/consent-authorization-sites/census/key-element-access-over-type-assertion-constant.ts",
      "plantedAt": "zz-unrelated/plain-directory/key-element-access-over-type-assertion-constant.ts",
      "signature": {
        "referenceClass": "unexpected",
        "constructor": "authorizeConsentForActor",
        "syntaxKind": "ElementAccessExpression"
      },
      "disposition": "classified",
      "census": "classified"
    },